{"epss_movers":[{"cve":"CVE-2026-35616","from":0.09098,"to":0.93983,"delta":0.84885,"kev":true,"product":"forticlientems"},{"cve":"CVE-2026-76460","from":0.14026,"to":0.66643,"delta":0.52617,"kev":true,"product":"identity_services_engine"},{"cve":"CVE-2026-28318","from":0.01942,"to":0.43651,"delta":0.41709,"kev":true,"product":"serv-u"},{"cve":"CVE-2026-105134","from":0.04782,"to":0.3831,"delta":0.33528,"kev":true,"product":"cloud_backup_suite"},{"cve":"CVE-2021-40449","from":0.74129,"to":0.81936,"delta":0.07807,"kev":true,"product":"windows_10_1507"},{"cve":"CVE-2026-42508","from":0.00654,"to":0.0691,"delta":0.06256,"kev":false,"product":"crypto"},{"cve":"CVE-2021-30119","from":0.53365,"to":0.58759,"delta":0.05394,"kev":false,"product":"vsa"}],"new_kev":[{"cve":"CVE-2026-110447","added":"2026-10-23","epss":0.02285,"product":"Collabora"},{"cve":"CVE-2026-114625","added":"2026-10-23","epss":0.00813,"product":"velocloud_orchestrator"},{"cve":"CVE-2026-106931","added":"2026-10-20","epss":0.0117,"product":"siteguard"},{"cve":"CVE-2026-96656","added":"2026-10-20","epss":0.00816,"product":"media_server"},{"cve":"CVE-2026-96654","added":"2026-10-20","epss":0.00465,"product":"media_server"},{"cve":"CVE-2026-96652","added":"2026-10-20","epss":0.00455,"product":"media_server"},{"cve":"CVE-2026-96655","added":"2026-10-20","epss":0.00455,"product":"media_server"},{"cve":"CVE-2026-110936","added":"2026-10-20","epss":0.00238,"product":"software_center"}],"volume":[{"date":"2026-09-26","count":752},{"date":"2026-09-27","count":731},{"date":"2026-09-28","count":745},{"date":"2026-09-29","count":769},{"date":"2026-09-30","count":773},{"date":"2026-10-01","count":778},{"date":"2026-10-02","count":769},{"date":"2026-10-03","count":746},{"date":"2026-10-04","count":729},{"date":"2026-10-05","count":731},{"date":"2026-10-06","count":762},{"date":"2026-10-07","count":764},{"date":"2026-10-08","count":766},{"date":"2026-10-09","count":750},{"date":"2026-10-10","count":735},{"date":"2026-10-11","count":709},{"date":"2026-10-12","count":723},{"date":"2026-10-13","count":754},{"date":"2026-10-14","count":764},{"date":"2026-10-15","count":773},{"date":"2026-10-16","count":766},{"date":"2026-10-17","count":742},{"date":"2026-10-18","count":718},{"date":"2026-10-19","count":728},{"date":"2026-10-20","count":762},{"date":"2026-10-21","count":780},{"date":"2026-10-22","count":762},{"date":"2026-10-23","count":763},{"date":"2026-10-24","count":739},{"date":"2026-10-25","count":731}],"totals":{"feed_count":731,"feed_delta":-8,"kev_count":1756,"kev_delta":8,"compared_to":"2026-10-18"},"generated_at":"2026-10-25T06:53:08Z","schema_version":1}